

SMART Attributes Data Structure revision number: 10
Vendor Specific SMART Attributes with Thresholds:
ID# ATTRIBUTE_NAME          FLAG     VALUE WORST THRESH TYPE      UPDATED  WHEN_FAILED RAW_VALUE
  1 Raw_Read_Error_Rate     0x000f   079   064   044    Pre-fail  Always       -       85872011
  3 Spin_Up_Time            0x0003   096   094   000    Pre-fail  Always       -       0
  4 Start_Stop_Count        0x0032   100   100   020    Old_age   Always       -       119
  5 Reallocated_Sector_Ct   0x0033   100   100   010    Pre-fail  Always       -       0
  7 Seek_Error_Rate         0x000f   084   060   045    Pre-fail  Always       -       246571042
  9 Power_On_Hours          0x0032   085   085   000    Old_age   Always       -       13373
 10 Spin_Retry_Count        0x0013   100   100   097    Pre-fail  Always       -       0
 12 Power_Cycle_Count       0x0032   100   100   020    Old_age   Always       -       97
 18 Head_Health             0x000b   100   100   050    Pre-fail  Always       -       0
187 Reported_Uncorrect      0x0032   100   100   000    Old_age   Always       -       0
188 Command_Timeout         0x0032   100   099   000    Old_age   Always       -       4295032833
190 Airflow_Temperature_Cel 0x0022   060   046   040    Old_age   Always       -       40 (Min/Max 38/40)
192 Power-Off_Retract_Count 0x0032   100   100   000    Old_age   Always       -       95
193 Load_Cycle_Count        0x0032   092   092   000    Old_age   Always       -       16825
194 Temperature_Celsius     0x0022   040   054   000    Old_age   Always       -       40 (0 25 0 0 0)
197 Current_Pending_Sector  0x0012   100   100   000    Old_age   Always       -       0
198 Offline_Uncorrectable   0x0010   100   100   000    Old_age   Offline      -       0
199 UDMA_CRC_Error_Count    0x003e   200   200   000    Old_age   Always       -       0
200 Pressure_Limit          0x0023   100   100   001    Pre-fail  Always       -       0
240 Head_Flying_Hours       0x0000   100   253   000    Old_age   Offline      -       9197h+23m+09.868s
241 Total_LBAs_Written      0x0000   100   253   000    Old_age   Offline      -       90702239367
242 Total_LBAs_Read         0x0000   100   253   000    Old_age   Offline      -       403652166102

SMART Error Log Version: 1
No Errors Logged

SMART Self-test log structure revision number 1
Num  Test_Description    Status                  Remaining  LifeTime(hours)  LBA_of_first_error
# 1  Short offline       Completed without error       00%     13373         -
# 2  Short offline       Interrupted (host reset)      00%     13373         -

SMART Selective self-test log data structure revision number 1
 SPAN  MIN_LBA  MAX_LBA  CURRENT_TEST_STATUS
    1        0        0  Not_testing
    2        0        0  Not_testing
    3        0        0  Not_testing
    4        0        0  Not_testing
    5        0        0  Not_testing
Selective self-test flags (0x0):
  After scanning selected spans, do NOT read-scan remainder of disk.
If Selective self-test is pending on power-up, resume after 0 minute delay.